{
  "$schema": "https://json-schema.org/draft/2020-12/schema",
  "$id": "https://conveyor.local/schemas/conveyor.plan@1",
  "title": "Conveyor Human Plan",
  "description": "Phase 0/1 normalized human-authored plan contract consumed by Conveyor's deterministic conductor.",
  "type": "object",
  "additionalProperties": false,
  "required": [
    "schema_version",
    "plan_id",
    "title",
    "project",
    "goal",
    "non_goals",
    "autonomy_level",
    "cutline",
    "requirements",
    "verification_commands",
    "decisions",
    "slices"
  ],
  "properties": {
    "schema_version": {
      "const": "conveyor.plan@1"
    },
    "plan_id": {
      "type": "string",
      "minLength": 1
    },
    "title": {
      "type": "string",
      "minLength": 1
    },
    "project": {
      "type": "object",
      "additionalProperties": false,
      "required": [
        "key",
        "name",
        "repository"
      ],
      "properties": {
        "key": {
          "type": "string",
          "minLength": 1
        },
        "name": {
          "type": "string",
          "minLength": 1
        },
        "repository": {
          "type": "string",
          "minLength": 1
        }
      }
    },
    "goal": {
      "type": "string",
      "minLength": 1
    },
    "non_goals": {
      "type": "array",
      "items": {
        "type": "string",
        "minLength": 1
      }
    },
    "autonomy_level": {
      "enum": [
        "L0",
        "L1",
        "L2",
        "L3",
        "L4"
      ]
    },
    "cutline": {
      "enum": [
        "TRACER_REQUIRED",
        "TRUST_REQUIRED"
      ]
    },
    "requirements": {
      "type": "array",
      "minItems": 1,
      "items": {
        "type": "object",
        "additionalProperties": false,
        "required": [
          "requirement_id",
          "title",
          "acceptance_criteria"
        ],
        "properties": {
          "requirement_id": {
            "type": "string",
            "minLength": 1
          },
          "title": {
            "type": "string",
            "minLength": 1
          },
          "acceptance_criteria": {
            "type": "array",
            "minItems": 1,
            "items": {
              "type": "object",
              "additionalProperties": false,
              "required": [
                "ac_id",
                "text"
              ],
              "properties": {
                "ac_id": {
                  "type": "string",
                  "minLength": 1
                },
                "text": {
                  "type": "string",
                  "minLength": 1
                }
              }
            }
          }
        }
      }
    },
    "verification_commands": {
      "type": "array",
      "minItems": 1,
      "items": {
        "type": "object",
        "additionalProperties": false,
        "required": [
          "command_id",
          "command"
        ],
        "properties": {
          "command_id": {
            "type": "string",
            "minLength": 1
          },
          "command": {
            "type": "array",
            "minItems": 1,
            "items": {
              "type": "string",
              "minLength": 1
            }
          }
        }
      }
    },
    "decisions": {
      "type": "array",
      "items": {
        "type": "object",
        "additionalProperties": false,
        "required": [
          "decision_id",
          "title",
          "rationale"
        ],
        "properties": {
          "decision_id": {
            "type": "string",
            "minLength": 1
          },
          "title": {
            "type": "string",
            "minLength": 1
          },
          "rationale": {
            "type": "string",
            "minLength": 1
          }
        }
      }
    },
    "slices": {
      "type": "array",
      "minItems": 1,
      "items": {
        "type": "object",
        "additionalProperties": false,
        "required": [
          "slice_id",
          "title",
          "requirement_refs",
          "decision_refs",
          "verification_refs",
          "likely_files",
          "conflict_domains",
          "autonomy_level"
        ],
        "properties": {
          "slice_id": {
            "type": "string",
            "minLength": 1
          },
          "title": {
            "type": "string",
            "minLength": 1
          },
          "requirement_refs": {
            "type": "array",
            "minItems": 1,
            "items": {
              "type": "string",
              "minLength": 1
            }
          },
          "decision_refs": {
            "type": "array",
            "items": {
              "type": "string",
              "minLength": 1
            }
          },
          "verification_refs": {
            "type": "array",
            "minItems": 1,
            "items": {
              "type": "string",
              "minLength": 1
            }
          },
          "likely_files": {
            "type": "array",
            "minItems": 1,
            "items": {
              "type": "string",
              "minLength": 1
            }
          },
          "conflict_domains": {
            "type": "array",
            "minItems": 1,
            "items": {
              "type": "string",
              "minLength": 1
            }
          },
          "autonomy_level": {
            "enum": [
              "L0",
              "L1",
              "L2",
              "L3",
              "L4"
            ]
          }
        }
      }
    }
  }
}
